commit	hyp	D	novelty	reach	cost_days	score	seconds	status	description
396b21b	R2-01	6.040	1.0	3	4	0.5556	1	keep	Self-generated counterflow: a single shrinking pair in a closed box stalls at b(d0, L, T) while zero-impulse pairs do not (D1 / R1a) | late d^2 slope: single pairs +0.0086 (early -0.0438), zero-impulse pairs -0.0335 over 2 tracks; W2 (L=96) unread
396b21b	R2-02	3.051	0.6	3	3	0.2288	12	keep	Acoustic memory: the vortex velocity autocorrelation has a negative lobe at the box acoustic time L/c, and diffusion is Markovian only beyond it (R1b) | residual-velocity autocorrelation at T=0.115 (32 tracks): most negative value in lags 40-100 is -0.0098 +- 0.0032 at lag 79 (L/c = 64); lag-1 -0.299, lag-10 +0.003, lag-64 +0.005
396b21b	R2-03	0.484	0.6	3	1	0.0484	12	keep	The Josephson offset eta_g1 K - 1 = +0.3 is the amplitude (density) fluctuations in g1: the phase-only correlator obeys eta K = 1 (D2 / R3) | eta*K-1 with g1: +0.225; with the phase-only correlator: +0.225 +- 0.111 (6 runs, torus Green function, r in [8,48]); difference +0.000 +- 0.001
396b21b	R2-04	16.162	0.6	3	3	0.3750	0	keep	The friction law alpha = 0.24 rho_n/rho: the prefactor is set by the Rayleigh-Jeans phonon bath up to the cutoff and shifts with cutoff and mg (D7 / R2) | alpha = c rho_n/rho: c = 0.232 +- 0.014; free intercept -0.0013 +- 0.0023 (zero within errors: proportional)
396b21b	R2-05	4.582	1.0	2	3	0.3818	82	keep	The box-scale pair's longevity is microcanonical: with a damping (canonical) term the same pair decays much faster (R4) | L=24 box-scale pair (d0=10): after 120 time units d = 9.10 (PGPE) vs 7.72 (damped GPE, gamma=0.02, mu=1): gap +1.37
396b21b	R2-06	0.000	1.0	3	14	0.0000	90	discard	Quantum vacuum noise (truncated Wigner) restores a transverse force: alpha' moves from 0 toward rho_n/rho (R5) | L=32, 80 time units: 1-alpha' classical 0.7753247038756306, with half-quantum noise None (no error bar possible in the budget)
396b21b	R2-07	6.289	0.6	3	5	0.3000	0	discard	Vortex versus phonon share of the stiffness near BKT: the vortex polarisability with the tight-pair current form factor accounts for less than half of rho_n(k1) in equilibrium (D3) | vortex share of rho_n(k1) in the five equilibrated runs: [0.105, 0.067, 0.228, 0.276, 0.267] (median 0.228)
396b21b	R2-08	1.841	1.0	3	4	0.2046	1	discard	Equilibration-time statistics of the last box-scale pair versus L (z from S_q(k_min, t)) (D5; H06 of round 1) | ln Q1 vs ln N_v over 7 depressed-stiffness runs (N_v 81-439): slope +0.25 +- 0.54 (one pair: 0; extensive: 1); Q1 median A 1.24 vs N 0.27
396b21b	R2-09	2.680	0.6	3	3	0.2010	0	discard	Cutoff law of the classical-field BKT point (D6; H09 of round 1) | n lambda^2 at BKT: predicted 7.75 (T = 0.811), measured 7.65 (L=64; L=32 gives 7.03), no-UV-log rival 5.94; sigma = L=32->64 shift = 0.67. RETRODICTION: inputs were known before registration
396b21b	R2-10	1.613	0.6	2	3	0.0807	0	discard	Einstein relation at a second admitted temperature (D4) | the one admitted temperature: R_E = 2.11 +- 0.69 (Einstein = 1; exponent 0.82)
