commit	hyp	D	novelty	reach	cost_days	score	seconds	status	description
5ecad2c	H01	1.470	0.6	3	4	0.0980	1	keep	Thermal mutual friction alpha(T), alpha(d) of a vortex dipole in a closed classical field, 0.14-0.95 T_BKT | median slope significance over 5 tracks; alpha = 0.126@T=0.66, 0.395@T=0.44, 0.002@T=0.11, 0.003@T=0.11, 0.006@T=0.11
5ecad2c	H02	12.775	1.0	3	5	0.5000	1	keep	Einstein relation for a quantized vortex in a closed field: eta = alpha T / (2 pi rho_0) | log10(eta_meas/eta_Einstein) = 0.99 +- 0.16 (15 blocks); Einstein = 0, Neely-like excess = 2
5ecad2c	H03	0.000	0.6	3	4	0.0000	2	crash	Transverse friction alpha' (Iordanskii force) for bosons: do vortices move at the point-vortex velocity? | no result
5ecad2c	H04	3.471	0.6	2	2	0.1984	11	keep	Equilibrium vortex matter is a Coulomb gas at the measured stiffness: pair-size law P(r) ~ r^(1-K) | P(r) ~ r^-a on r in [1.4, 6]: a vs K over 11 runs, slope 0.25 +- 0.07 (law: a = K - 1 at the local K; rival: 0), a range 4.7-6.6
5ecad2c	H05	0.872	0.6	2	2	0.0498	1	discard	Josephson relation eta*K = 1 quantified on the torus: the 12-27 % offset is a geometry/window artefact | eta*K - 1 with the torus Green function on r in [8, 32]: +0.287 +- 0.229 over 5 admitted L=128 runs (standard window, block mean: +0.359); H: 0, rival: +0.2
5ecad2c	H06	1.841	1.0	3	4	0.2046	1	keep	Last-pair equilibration: the box-scale vortex charge is one pair whatever the vortex number; time-resolved S_q(k_min) gives z and the equilibration-time law | ln Q1 vs ln N_v over 7 depressed-stiffness runs (N_v 81-439): slope +0.25 +- 0.54 (one pair: 0; extensive: 1); Q1 median A 1.24 vs N 0.27
5ecad2c	H07	14.355	0.6	2	2	0.2857	29	keep	Finite-k dielectric relation of a compressible superfluid: transverse response = vortex polarisation + phonon floor at every k | shells |m|^2 = 5..16 only (none used before): R_T vs vortex-only R_T over 36 (run, shell) points, r = 0.987, slope 0.60, floor 0.13
5ecad2c	H08	0.000	0.6	3	6	0.0000	116	discard	Decay law of an imposed supercurrent on the torus: slip rate vs velocity, AHNS exponent 1 + K/2 against MWJO exponent K - 1 | L=32, T~0.79 (K~5.4): slips at windings 1/2/3 = 0/0/0 in 120/120/120 time units (final W 1/2/3)
5ecad2c	H09	2.680	0.6	3	3	0.2010	0	discard	Cutoff law of the classical-field BKT point: n_c lambda^2 = ln(380/g) + ln(E_cut/T), slope exactly 1 in ln E_cut | n lambda^2 at BKT: predicted 7.75 (T = 0.811), measured 7.65 (L=64; L=32 gives 7.03), no-UV-log rival 5.94; sigma = L=32->64 shift = 0.67. RETRODICTION: inputs were known before registration
5ecad2c	H10	1.815	0.3	2	4	0.0403	15	discard	Two-fluid sound from the closed field's own dynamics: a second branch in S(k, omega) at L = 192 | upper branch c1 = 0.75, 0.77, 0.70, 0.67, 0.52, 0.61; candidate lower branch c2 = 0.52(z=3.1), 0.53(z=4.8), 0.49(z=1.4), 0.46(z=1.5), 0.36(z=1.5), 0.42(z=2.1)
5ecad2c	H03	3.829	0.6	3	4	0.2552	6	keep	Transverse friction alpha' (Iordanskii force) for bosons: do vortices move at the point-vortex velocity? | known-answer slope at T=0.115: 0.997 +- 0.009; 1-alpha' = 0.717 +- 0.045 (rho_n/rho = 0.41); 1-alpha' = 0.833 +- 0.046 (rho_n/rho = 0.18)
